[00:00:08.937] Server  LOG      ✓ Ready in 5.3s
[00:00:12.674] Server  LOG      ○ Compiling / ...
[00:00:36.136] Browser INFO    %cDownload the React DevTools for a better development experience: https://react.dev/link/react-devtools font-weight:bold
[00:00:36.292] Browser INFO    %cDownload the React DevTools for a better development experience: https://react.dev/link/react-devtools font-weight:bold
[00:00:36.292] Browser ERROR   A tree hydrated but some attributes of the server rendered HTML didn't match the client properties. This won't be patched up. This can happen if a SSR-ed Client Component used:

- A server/client branch `if (typeof window !== 'undefined')`.
- Variable input such as `Date.now()` or `Math.random()` which changes each time it's called.
- Date formatting in a user's locale which doesn't match the server.
- External changing data without sending a snapshot of it along with the HTML.
- Invalid HTML tag nesting.

It can also happen if the client has a browser extension installed which messes with the HTML before React loaded.

%s%s https://react.dev/link/hydration-mismatch 

  ...
    <SegmentViewNode type="page" pagePath="/Downloads...">
      <SegmentTrieNode>
      <ClientPageRoot Component={function Home} serverProvidedParams={{...}}>
        <Home params={Promise} searchParams={Promise}>
          <main className="min-h-scre...">
            <AnimatePresence mode="wait">
              <PresenceChild isPresent={true} initial={undefined} custom={undefined} presenceAffectsLayout={true} ...>
                <LocationStep onComplete={function handleLocationComplete}>
                  <motion.div initial={{y:20}} animate={{y:0}} exit={{y:-20}} className="relative f...">
                    <div className="relative f..." style={{...}} ref={function useMotionRef.useCallback}>
                      <div>
                      <div>
                      <div>
                      <div className="relative z...">
                        <motion.div>
                        <div>
                        <form onSubmit={function handleSubmit} className="space-y-5 ...">
                          <div className="relative r...">
                            <GlowingEffect>
                            <div className="relative">
                              <Input type="text" placeholder="Enter the ..." value="" onChange={function onChange} ...>
                                <input
                                  type="text"
                                  data-slot="input"
                                  className="file:text-foreground selection:bg-primary selection:text-primary-foregrou..."
                                  placeholder="Enter the city, zipcode, state, etc. of your volunteer work"
                                  value=""
                                  onChange={function onChange}
-                                 fdprocessedid="w1wq6s"
                                >
                          <Button type="button" variant="outline" className="w-full h-1..." ...>
                            <button
                              data-slot="button"
                              className={"inline-flex items-center justify-center gap-2 whitespace-nowrap rounded-md ..."}
                              type="button"
                              onClick={function handleDetectLocation}
                              disabled={false}
-                             fdprocessedid="pvor"
                            >
                          ...
            ...
    ...

[00:00:36.292] Browser LOG     %c[Vercel Web Analytics]%c Debug mode is enabled by default in development. No requests will be sent to the server. color: rgb(120, 120, 120) color: inherit
[00:00:36.292] Browser LOG     %c[Vercel Web Analytics]%c Running queued event color: rgb(120, 120, 120) color: inherit pageview {"path":"/","route":"/"}
[00:00:36.292] Browser LOG     %c[Vercel Web Analytics]%c [pageview] http://localhost:3000/ color: rgb(120, 120, 120) color: inherit {"dp":"/","o":"http://localhost:3000/","sdkn":"@vercel/analytics/next","sdkv":"1.3.1","sv":"0.1.3","ts":1769919273043}
[00:00:38.152] Browser ERROR   A tree hydrated but some attributes of the server rendered HTML didn't match the client properties. This won't be patched up. This can happen if a SSR-ed Client Component used:

- A server/client branch `if (typeof window !== 'undefined')`.
- Variable input such as `Date.now()` or `Math.random()` which changes each time it's called.
- Date formatting in a user's locale which doesn't match the server.
- External changing data without sending a snapshot of it along with the HTML.
- Invalid HTML tag nesting.

It can also happen if the client has a browser extension installed which messes with the HTML before React loaded.

%s%s https://react.dev/link/hydration-mismatch 

  ...
    <HotReload globalError={[...]} webSocket={WebSocket} staticIndicatorState={{pathname:null, ...}}>
      <AppDevOverlayErrorBoundary globalError={[...]}>
        <ReplaySsrOnlyErrors>
        <DevRootHTTPAccessFallbackBoundary>
          <HTTPAccessFallbackBoundary notFound={<NotAllowedRootHTTPFallbackError>}>
            <HTTPAccessFallbackErrorBoundary pathname="/" notFound={<NotAllowedRootHTTPFallbackError>} ...>
              <RedirectBoundary>
                <RedirectErrorBoundary router={{...}}>
                  <Head>
                  <__next_root_layout_boundary__>
                    <SegmentViewNode type="layout" pagePath="/Downloads...">
                      <SegmentTrieNode>
                      <link>
                      <script>
                      <script>
                      <RootLayout>
                        <html lang="en">
                          <body
                            className="font-sans antialiased"
-                           data-new-gr-c-s-check-loaded="14.1271.0"
-                           data-gr-ext-installed=""
-                           data-gr-ext-disabled="forever"
                          >
                  ...

[00:00:38.153] Browser LOG     %c[Vercel Web Analytics]%c Debug mode is enabled by default in development. No requests will be sent to the server. color: rgb(120, 120, 120) color: inherit
[00:00:38.153] Browser LOG     %c[Vercel Web Analytics]%c Running queued event color: rgb(120, 120, 120) color: inherit pageview {"path":"/","route":"/"}
[00:00:38.153] Browser LOG     %c[Vercel Web Analytics]%c [pageview] http://localhost:3000/ color: rgb(120, 120, 120) color: inherit {"dp":"/","o":"http://localhost:3000/","sdkn":"@vercel/analytics/next","sdkv":"1.3.1","sv":"0.1.3","ts":1769919275154}
[00:02:44.021] Browser INFO    %cDownload the React DevTools for a better development experience: https://react.dev/link/react-devtools font-weight:bold
[00:02:44.021] Browser LOG     %c[Vercel Web Analytics]%c Debug mode is enabled by default in development. No requests will be sent to the server. color: rgb(120, 120, 120) color: inherit
[00:02:44.021] Browser LOG     %c[Vercel Web Analytics]%c Running queued event color: rgb(120, 120, 120) color: inherit pageview {"path":"/","route":"/"}
[00:02:44.021] Browser LOG     %c[Vercel Web Analytics]%c [pageview] http://localhost:3000/ color: rgb(120, 120, 120) color: inherit {"dp":"/","o":"http://localhost:3000/","sdkn":"@vercel/analytics/next","sdkv":"1.3.1","sv":"0.1.3","ts":1769919400944}
[00:05:50.991] Browser LOG     ✓ Call initiated: {"callId":"019c176d-a2de-7446-8ddd-1374c91337c8","ok":true}
[00:05:50.991] Browser LOG     ⏳ [Poll 1] Checking call 019c176d-a2de-7446-8ddd-1374c91337c8 status...
[00:05:51.393] Browser LOG     📊 Status response: {"completed":false,"ok":true,"status":"queued"}
[00:05:54.342] Browser LOG     ⏳ [Poll 2] Checking call 019c176d-a2de-7446-8ddd-1374c91337c8 status...
[00:05:54.610] Browser LOG     📊 Status response: {"completed":false,"ok":true,"status":"queued"}
[00:05:57.619] Browser LOG     ⏳ [Poll 3] Checking call 019c176d-a2de-7446-8ddd-1374c91337c8 status...
[00:05:59.162] Browser LOG     📊 Status response: {"completed":false,"ok":true,"status":"in-progress"}
[00:06:02.381] Browser LOG     ⏳ [Poll 4] Checking call 019c176d-a2de-7446-8ddd-1374c91337c8 status...
[00:06:02.623] Browser LOG     📊 Status response: {"completed":false,"ok":true,"status":"in-progress"}
[00:06:05.826] Browser LOG     ⏳ [Poll 5] Checking call 019c176d-a2de-7446-8ddd-1374c91337c8 status...
[00:06:06.079] Browser LOG     📊 Status response: {"completed":false,"ok":true,"status":"in-progress"}
[00:06:09.255] Browser LOG     ⏳ [Poll 6] Checking call 019c176d-a2de-7446-8ddd-1374c91337c8 status...
[00:06:09.374] Browser LOG     📊 Status response: {"completed":false,"ok":true,"status":"in-progress"}
[00:06:12.531] Browser LOG     ⏳ [Poll 7] Checking call 019c176d-a2de-7446-8ddd-1374c91337c8 status...
[00:06:12.640] Browser LOG     📊 Status response: {"completed":false,"ok":true,"status":"in-progress"}
[00:06:15.814] Browser LOG     ⏳ [Poll 8] Checking call 019c176d-a2de-7446-8ddd-1374c91337c8 status...
[00:06:15.917] Browser LOG     📊 Status response: {"completed":false,"ok":true,"status":"in-progress"}
[00:06:18.924] Browser LOG     ⏳ [Poll 9] Checking call 019c176d-a2de-7446-8ddd-1374c91337c8 status...
[00:06:19.157] Browser LOG     📊 Status response: {"completed":false,"ok":true,"status":"in-progress"}
[00:06:22.354] Browser LOG     ⏳ [Poll 10] Checking call 019c176d-a2de-7446-8ddd-1374c91337c8 status...
[00:06:22.457] Browser LOG     📊 Status response: {"completed":false,"ok":true,"status":"in-progress"}
[00:06:25.641] Browser LOG     ⏳ [Poll 11] Checking call 019c176d-a2de-7446-8ddd-1374c91337c8 status...
[00:06:25.844] Browser LOG     📊 Status response: {"completed":false,"ok":true,"status":"in-progress"}
[00:06:28.756] Browser LOG     ⏳ [Poll 12] Checking call 019c176d-a2de-7446-8ddd-1374c91337c8 status...
[00:06:28.994] Browser LOG     📊 Status response: {"completed":false,"ok":true,"status":"in-progress"}
[00:06:32.035] Browser LOG     ⏳ [Poll 13] Checking call 019c176d-a2de-7446-8ddd-1374c91337c8 status...
[00:06:32.587] Browser LOG     📊 Status response: {"completed":false,"ok":true,"status":"in-progress"}
[00:06:35.676] Browser LOG     ⏳ [Poll 14] Checking call 019c176d-a2de-7446-8ddd-1374c91337c8 status...
[00:06:36.068] Browser LOG     📊 Status response: {"completed":false,"ok":true,"status":"in-progress"}
[00:06:39.344] Browser LOG     ⏳ [Poll 15] Checking call 019c176d-a2de-7446-8ddd-1374c91337c8 status...
[00:06:39.709] Browser LOG     📊 Status response: {"completed":false,"ok":true,"status":"in-progress"}
[00:06:42.842] Browser LOG     ⏳ [Poll 16] Checking call 019c176d-a2de-7446-8ddd-1374c91337c8 status...
[00:06:42.951] Browser LOG     📊 Status response: {"completed":false,"ok":true,"status":"in-progress"}
[00:06:46.134] Browser LOG     ⏳ [Poll 17] Checking call 019c176d-a2de-7446-8ddd-1374c91337c8 status...
[00:06:46.266] Browser LOG     📊 Status response: {"completed":false,"ok":true,"status":"in-progress"}
[00:06:49.406] Browser LOG     ⏳ [Poll 18] Checking call 019c176d-a2de-7446-8ddd-1374c91337c8 status...
[00:06:49.910] Browser LOG     📊 Status response: {"completed":false,"ok":true,"status":"in-progress"}
[00:06:52.909] Browser LOG     ⏳ [Poll 19] Checking call 019c176d-a2de-7446-8ddd-1374c91337c8 status...
[00:06:53.191] Browser LOG     📊 Status response: {"completed":false,"ok":true,"status":"in-progress"}
[00:06:56.275] Browser LOG     ⏳ [Poll 20] Checking call 019c176d-a2de-7446-8ddd-1374c91337c8 status...
[00:06:56.459] Browser LOG     📊 Status response: {"completed":false,"ok":true,"status":"in-progress"}
[00:06:59.474] Browser LOG     ⏳ [Poll 21] Checking call 019c176d-a2de-7446-8ddd-1374c91337c8 status...
[00:07:00.156] Browser LOG     📊 Status response: {"completed":false,"ok":true,"status":"in-progress"}
[00:07:03.118] Browser LOG     ⏳ [Poll 22] Checking call 019c176d-a2de-7446-8ddd-1374c91337c8 status...
[00:07:03.322] Browser LOG     📊 Status response: {"completed":false,"ok":true,"status":"in-progress"}
[00:07:06.224] Browser LOG     ⏳ [Poll 23] Checking call 019c176d-a2de-7446-8ddd-1374c91337c8 status...
[00:07:09.841] Browser LOG     📊 Status response: {"completed":true,"ok":true,"status":"ended","summary":"Noel Thomas from Kocarni and Thomas Food Bank expressed strong interest in assisting with the homeless nonprofit project and will be contacted via email to arrange a meeting.","transcript":"AI: Hi. This is Mission Match. Calling on behalf of a volunteer project. We're reaching out because someone needs help with I have a 5 0 1 c 3 nonprofit organization. Dedicated to to the homeless. Would Kocarni and Thomas Food Bank be able to assist? If so, who should we contact? And what are the next steps?\nUser: Yes. Of course. I'm 100 percent down to do that. If needed, my email is noelle thomas at g mail dot com. And I'm free on February seventeenth this year, and I'd love to get take a meeting and just talk to the people behind this project get to know them, and figure out what they can do to help us. But today, I'm in a bit of a rush, so I'll have to head in the call soon. But thank you for calling me again.\nAI: Thank you so much, Noel. That's incredibly helpful. Just to confirm, is Noel Thomas the best point of contact for follow-up? And would email be the best way to reach you?\nUser: Yes. Yes. It is. I have to go right now, but but thank you for for calling me.\nAI: Absolutely. Thank you again, Noel. We'll follow-up by email, Have a great day.\nUser: Have a great day. Bye.\n"}
[00:07:09.841] Browser LOG     ✓ Call completed!
[00:07:09.841] Browser LOG     📋 Fetching summary for key: +16693313021
[00:07:10.269] Browser LOG     ✓ Summary fetched: {"data":{"availability":"February seventeenth this year","call_id":"+16693313021","contact_name":"Noel Thomas","created_at":"2026-01-31T23:02:11.390326+00:00","interested":true,"next_steps":["Follow-up by email","Schedule meeting to discuss project details"],"org_id":null,"summary":"Noel Thomas from Kocarni and Thomas Food Bank expressed strong interest in assisting with the homeless nonprofit project and will be contacted via email to arrange a meeting.","updated_at":"2026-02-01T04:21:07.273+00:00","vapi_analysis":{"successEvaluation":"true","summary":"Mission Match called Kocarni and Thomas Food Bank on behalf of a 501c3 nonprofit assisting the homeless, inquiring about potential support. Noelle Thomas from the food bank expressed willingness to help, provided her email (noellethomas@gmail.com), and suggested a meeting on February 17th to discuss collaboration. Mission Match confirmed Noelle and email as the best contact method for follow-up."}},"ok":true}
[00:07:10.269] Browser LOG     ✓ UI updated to completed
[00:10:10.310] Browser INFO    %cDownload the React DevTools for a better development experience: https://react.dev/link/react-devtools font-weight:bold
[00:10:11.741] Browser ERROR   A tree hydrated but some attributes of the server rendered HTML didn't match the client properties. This won't be patched up. This can happen if a SSR-ed Client Component used:

- A server/client branch `if (typeof window !== 'undefined')`.
- Variable input such as `Date.now()` or `Math.random()` which changes each time it's called.
- Date formatting in a user's locale which doesn't match the server.
- External changing data without sending a snapshot of it along with the HTML.
- Invalid HTML tag nesting.

It can also happen if the client has a browser extension installed which messes with the HTML before React loaded.

%s%s https://react.dev/link/hydration-mismatch 

  ...
    <SegmentViewNode type="page" pagePath="/Downloads...">
      <SegmentTrieNode>
      <ClientPageRoot Component={function Home} serverProvidedParams={{...}}>
        <Home params={Promise} searchParams={Promise}>
          <main className="min-h-scre...">
            <AnimatePresence mode="wait">
              <PresenceChild isPresent={true} initial={undefined} custom={undefined} presenceAffectsLayout={true} ...>
                <LocationStep onComplete={function handleLocationComplete}>
                  <motion.div initial={{y:20}} animate={{y:0}} exit={{y:-20}} className="relative f...">
                    <div className="relative f..." style={{...}} ref={function useMotionRef.useCallback}>
                      <div>
                      <div>
                      <div>
                      <div className="relative z...">
                        <motion.div>
                        <div>
                        <form onSubmit={function handleSubmit} className="space-y-5 ...">
                          <div className="relative r...">
                            <GlowingEffect>
                            <div className="relative">
                              <Input type="text" placeholder="Enter the ..." value="" onChange={function onChange} ...>
                                <input
                                  type="text"
                                  data-slot="input"
                                  className="file:text-foreground selection:bg-primary selection:text-primary-foregrou..."
                                  placeholder="Enter the city, zipcode, state, etc. of your volunteer work"
                                  value=""
                                  onChange={function onChange}
-                                 fdprocessedid="eqvt4a"
                                >
                          <Button type="button" variant="outline" className="w-full h-1..." ...>
                            <button
                              data-slot="button"
                              className={"inline-flex items-center justify-center gap-2 whitespace-nowrap rounded-md ..."}
                              type="button"
                              onClick={function handleDetectLocation}
                              disabled={false}
-                             fdprocessedid="yhmhn"
                            >
                          ...
            ...
    ...

[00:10:11.741] Browser LOG     %c[Vercel Web Analytics]%c Debug mode is enabled by default in development. No requests will be sent to the server. color: rgb(120, 120, 120) color: inherit
[00:10:11.741] Browser LOG     %c[Vercel Web Analytics]%c Running queued event color: rgb(120, 120, 120) color: inherit pageview {"path":"/","route":"/"}
[00:10:11.741] Browser LOG     %c[Vercel Web Analytics]%c [pageview] http://localhost:3000/ color: rgb(120, 120, 120) color: inherit {"dp":"/","o":"http://localhost:3000/","sdkn":"@vercel/analytics/next","sdkv":"1.3.1","sv":"0.1.3","ts":1769919847995}
[00:14:12.162] Browser ERROR   Find organizations failed {}
[00:14:15.382] Browser INFO    %cDownload the React DevTools for a better development experience: https://react.dev/link/react-devtools font-weight:bold
[00:14:15.382] Browser ERROR   A tree hydrated but some attributes of the server rendered HTML didn't match the client properties. This won't be patched up. This can happen if a SSR-ed Client Component used:

- A server/client branch `if (typeof window !== 'undefined')`.
- Variable input such as `Date.now()` or `Math.random()` which changes each time it's called.
- Date formatting in a user's locale which doesn't match the server.
- External changing data without sending a snapshot of it along with the HTML.
- Invalid HTML tag nesting.

It can also happen if the client has a browser extension installed which messes with the HTML before React loaded.

%s%s https://react.dev/link/hydration-mismatch 

  ...
    <SegmentViewNode type="page" pagePath="/Downloads...">
      <SegmentTrieNode>
      <ClientPageRoot Component={function Home} serverProvidedParams={{...}}>
        <Home params={Promise} searchParams={Promise}>
          <main className="min-h-scre...">
            <AnimatePresence mode="wait">
              <PresenceChild isPresent={true} initial={undefined} custom={undefined} presenceAffectsLayout={true} ...>
                <LocationStep onComplete={function handleLocationComplete}>
                  <motion.div initial={{y:20}} animate={{y:0}} exit={{y:-20}} className="relative f...">
                    <div className="relative f..." style={{...}} ref={function useMotionRef.useCallback}>
                      <div>
                      <div>
                      <div>
                      <div className="relative z...">
                        <motion.div>
                        <div>
                        <form onSubmit={function handleSubmit} className="space-y-5 ...">
                          <div className="relative r...">
                            <GlowingEffect>
                            <div className="relative">
                              <Input type="text" placeholder="Enter the ..." value="" onChange={function onChange} ...>
                                <input
                                  type="text"
                                  data-slot="input"
                                  className="file:text-foreground selection:bg-primary selection:text-primary-foregrou..."
                                  placeholder="Enter the city, zipcode, state, etc. of your volunteer work"
                                  value=""
                                  onChange={function onChange}
-                                 fdprocessedid="4ckmns"
                                >
                          <Button type="button" variant="outline" className="w-full h-1..." ...>
                            <button
                              data-slot="button"
                              className={"inline-flex items-center justify-center gap-2 whitespace-nowrap rounded-md ..."}
                              type="button"
                              onClick={function handleDetectLocation}
                              disabled={false}
-                             fdprocessedid="0rdt4c"
                            >
                          ...
            ...
    ...

[00:14:15.382] Browser LOG     %c[Vercel Web Analytics]%c Debug mode is enabled by default in development. No requests will be sent to the server. color: rgb(120, 120, 120) color: inherit
[00:14:15.382] Browser LOG     %c[Vercel Web Analytics]%c Running queued event color: rgb(120, 120, 120) color: inherit pageview {"path":"/","route":"/"}
[00:14:15.382] Browser LOG     %c[Vercel Web Analytics]%c [pageview] http://localhost:3000/ color: rgb(120, 120, 120) color: inherit {"dp":"/","o":"http://localhost:3000/","sdkn":"@vercel/analytics/next","sdkv":"1.3.1","sv":"0.1.3","ts":1769920092398}
[00:14:59.910] Browser INFO    %cDownload the React DevTools for a better development experience: https://react.dev/link/react-devtools font-weight:bold
[00:14:59.910] Browser ERROR   A tree hydrated but some attributes of the server rendered HTML didn't match the client properties. This won't be patched up. This can happen if a SSR-ed Client Component used:

- A server/client branch `if (typeof window !== 'undefined')`.
- Variable input such as `Date.now()` or `Math.random()` which changes each time it's called.
- Date formatting in a user's locale which doesn't match the server.
- External changing data without sending a snapshot of it along with the HTML.
- Invalid HTML tag nesting.

It can also happen if the client has a browser extension installed which messes with the HTML before React loaded.

%s%s https://react.dev/link/hydration-mismatch 

  ...
    <SegmentViewNode type="page" pagePath="/Downloads...">
      <SegmentTrieNode>
      <ClientPageRoot Component={function Home} serverProvidedParams={{...}}>
        <Home params={Promise} searchParams={Promise}>
          <main className="min-h-scre...">
            <AnimatePresence mode="wait">
              <PresenceChild isPresent={true} initial={undefined} custom={undefined} presenceAffectsLayout={true} ...>
                <LocationStep onComplete={function handleLocationComplete}>
                  <motion.div initial={{y:20}} animate={{y:0}} exit={{y:-20}} className="relative f...">
                    <div className="relative f..." style={{...}} ref={function useMotionRef.useCallback}>
                      <div>
                      <div>
                      <div>
                      <div className="relative z...">
                        <motion.div>
                        <div>
                        <form onSubmit={function handleSubmit} className="space-y-5 ...">
                          <div className="relative r...">
                            <GlowingEffect>
                            <div className="relative">
                              <Input type="text" placeholder="Enter the ..." value="" onChange={function onChange} ...>
                                <input
                                  type="text"
                                  data-slot="input"
                                  className="file:text-foreground selection:bg-primary selection:text-primary-foregrou..."
                                  placeholder="Enter the city, zipcode, state, etc. of your volunteer work"
                                  value=""
                                  onChange={function onChange}
-                                 fdprocessedid="tesih"
                                >
                          <Button type="button" variant="outline" className="w-full h-1..." ...>
                            <button
                              data-slot="button"
                              className={"inline-flex items-center justify-center gap-2 whitespace-nowrap rounded-md ..."}
                              type="button"
                              onClick={function handleDetectLocation}
                              disabled={false}
-                             fdprocessedid="8h37w"
                            >
                          ...
            ...
    ...

[00:14:59.910] Browser LOG     %c[Vercel Web Analytics]%c Debug mode is enabled by default in development. No requests will be sent to the server. color: rgb(120, 120, 120) color: inherit
[00:14:59.910] Browser LOG     %c[Vercel Web Analytics]%c Running queued event color: rgb(120, 120, 120) color: inherit pageview {"path":"/","route":"/"}
[00:14:59.910] Browser LOG     %c[Vercel Web Analytics]%c [pageview] http://localhost:3000/ color: rgb(120, 120, 120) color: inherit {"dp":"/","o":"http://localhost:3000/","sdkn":"@vercel/analytics/next","sdkv":"1.3.1","sv":"0.1.3","ts":1769920136989}
[00:16:49.025] Browser LOG     ✓ Call initiated: {"callId":"019c1777-ad94-7330-a9e4-ad133a581b29","ok":true}
[00:16:49.025] Browser LOG     ⏳ [Poll 1] Checking call 019c1777-ad94-7330-a9e4-ad133a581b29 status...
[00:16:49.245] Browser LOG     📊 Status response: {"completed":false,"ok":true,"status":"queued"}
[00:16:52.227] Browser LOG     ⏳ [Poll 2] Checking call 019c1777-ad94-7330-a9e4-ad133a581b29 status...
[00:16:52.444] Browser LOG     📊 Status response: {"completed":false,"ok":true,"status":"queued"}
[00:16:55.448] Browser LOG     ⏳ [Poll 3] Checking call 019c1777-ad94-7330-a9e4-ad133a581b29 status...
[00:16:55.764] Browser LOG     📊 Status response: {"completed":false,"ok":true,"status":"in-progress"}
[00:16:58.755] Browser LOG     ⏳ [Poll 4] Checking call 019c1777-ad94-7330-a9e4-ad133a581b29 status...
[00:16:58.995] Browser LOG     📊 Status response: {"completed":false,"ok":true,"status":"in-progress"}
[00:17:02.162] Browser LOG     ⏳ [Poll 5] Checking call 019c1777-ad94-7330-a9e4-ad133a581b29 status...
[00:17:02.266] Browser LOG     📊 Status response: {"completed":false,"ok":true,"status":"in-progress"}
[00:17:05.275] Browser LOG     ⏳ [Poll 6] Checking call 019c1777-ad94-7330-a9e4-ad133a581b29 status...
[00:17:06.037] Browser LOG     📊 Status response: {"completed":false,"ok":true,"status":"in-progress"}
[00:17:09.180] Browser LOG     ⏳ [Poll 7] Checking call 019c1777-ad94-7330-a9e4-ad133a581b29 status...
[00:17:09.638] Browser LOG     📊 Status response: {"completed":false,"ok":true,"status":"in-progress"}
[00:17:12.812] Browser LOG     ⏳ [Poll 8] Checking call 019c1777-ad94-7330-a9e4-ad133a581b29 status...
[00:17:13.764] Browser LOG     📊 Status response: {"completed":false,"ok":true,"status":"in-progress"}
[00:17:16.917] Browser LOG     ⏳ [Poll 9] Checking call 019c1777-ad94-7330-a9e4-ad133a581b29 status...
[00:17:17.039] Browser LOG     📊 Status response: {"completed":false,"ok":true,"status":"in-progress"}
[00:17:20.289] Browser LOG     ⏳ [Poll 10] Checking call 019c1777-ad94-7330-a9e4-ad133a581b29 status...
[00:17:20.778] Browser LOG     📊 Status response: {"completed":false,"ok":true,"status":"in-progress"}
[00:17:23.977] Browser LOG     ⏳ [Poll 11] Checking call 019c1777-ad94-7330-a9e4-ad133a581b29 status...
[00:17:24.382] Browser LOG     📊 Status response: {"completed":false,"ok":true,"status":"in-progress"}
[00:17:27.397] Browser LOG     ⏳ [Poll 12] Checking call 019c1777-ad94-7330-a9e4-ad133a581b29 status...
[00:17:27.991] Browser LOG     📊 Status response: {"completed":false,"ok":true,"status":"in-progress"}
[00:17:31.252] Browser LOG     ⏳ [Poll 13] Checking call 019c1777-ad94-7330-a9e4-ad133a581b29 status...
[00:17:31.348] Browser LOG     📊 Status response: {"completed":false,"ok":true,"status":"in-progress"}
[00:17:34.521] Browser LOG     ⏳ [Poll 14] Checking call 019c1777-ad94-7330-a9e4-ad133a581b29 status...
[00:17:37.798] Browser LOG     📊 Status response: {"completed":true,"ok":true,"status":"ended","summary":"Noel Thomas from Kokarni and Thomas Food Bank expressed willingness to help with the nonprofit organization's homeless assistance project and provided email contact for follow-up coordination.","transcript":"AI: Hi. This is Mitchamatch calling on behalf of a volunteer project. We're reaching out because someone needs help with I have a nonprofit organization dedicated to to the homeless. Would Kokarni and Thomas Food Bank be able to assist? If so, who should we contact, and what are the next steps?\nUser: Yes. I can definitely help with you. I'm in a bit of rush right now. To hang up after this, but reach me out reach out to me at noel thomas at g mail dot com. So yeah, have a great day.\nAI: Thank you, Noel. We appreciate your willingness to help. I'll reach out to you by email for the next steps. Have a great day.\nUser: Yep.\n"}
[00:17:37.798] Browser LOG     ✓ Call completed!
[00:17:37.798] Browser LOG     📋 Fetching summary for key: +16693313021
[00:17:38.121] Browser LOG     ✓ Summary fetched: {"data":{"availability":null,"call_id":"+16693313021","contact_name":"Noel Thomas","created_at":"2026-01-31T23:02:11.390326+00:00","interested":true,"next_steps":["Reach out via email at noelthomas@gmail.com","Follow up for specific assistance details"],"org_id":null,"summary":"Noel Thomas from Kokarni and Thomas Food Bank expressed willingness to help with the nonprofit organization's homeless assistance project and provided email contact for follow-up coordination.","updated_at":"2026-02-01T04:31:35.183+00:00","vapi_analysis":{"successEvaluation":"true","summary":"Mitchamatch, representing a volunteer project for a homeless nonprofit, contacted the Kokarni and Thomas Food Bank to inquire about potential assistance. Noel from the food bank confirmed they could help and provided their email address (noelthomas@gmail.com) for Mitchamatch to follow up and discuss next steps. Mitchamatch agreed to reach out via email."}},"ok":true}
[00:17:38.121] Browser LOG     ✓ UI updated to completed
[00:19:19.229] Browser INFO    %cDownload the React DevTools for a better development experience: https://react.dev/link/react-devtools font-weight:bold
[00:19:19.229] Browser ERROR   A tree hydrated but some attributes of the server rendered HTML didn't match the client properties. This won't be patched up. This can happen if a SSR-ed Client Component used:

- A server/client branch `if (typeof window !== 'undefined')`.
- Variable input such as `Date.now()` or `Math.random()` which changes each time it's called.
- Date formatting in a user's locale which doesn't match the server.
- External changing data without sending a snapshot of it along with the HTML.
- Invalid HTML tag nesting.

It can also happen if the client has a browser extension installed which messes with the HTML before React loaded.

%s%s https://react.dev/link/hydration-mismatch 

  ...
    <SegmentViewNode type="page" pagePath="/Downloads...">
      <SegmentTrieNode>
      <ClientPageRoot Component={function Home} serverProvidedParams={{...}}>
        <Home params={Promise} searchParams={Promise}>
          <main className="min-h-scre...">
            <AnimatePresence mode="wait">
              <PresenceChild isPresent={true} initial={undefined} custom={undefined} presenceAffectsLayout={true} ...>
                <LocationStep onComplete={function handleLocationComplete}>
                  <motion.div initial={{y:20}} animate={{y:0}} exit={{y:-20}} className="relative f...">
                    <div className="relative f..." style={{...}} ref={function useMotionRef.useCallback}>
                      <div>
                      <div>
                      <div>
                      <div className="relative z...">
                        <motion.div>
                        <div>
                        <form onSubmit={function handleSubmit} className="space-y-5 ...">
                          <div className="relative r...">
                            <GlowingEffect>
                            <div className="relative">
                              <Input type="text" placeholder="Enter the ..." value="" onChange={function onChange} ...>
                                <input
                                  type="text"
                                  data-slot="input"
                                  className="file:text-foreground selection:bg-primary selection:text-primary-foregrou..."
                                  placeholder="Enter the city, zipcode, state, etc. of your volunteer work"
                                  value=""
                                  onChange={function onChange}
-                                 fdprocessedid="txqcog"
                                >
                          <Button type="button" variant="outline" className="w-full h-1..." ...>
                            <button
                              data-slot="button"
                              className={"inline-flex items-center justify-center gap-2 whitespace-nowrap rounded-md ..."}
                              type="button"
                              onClick={function handleDetectLocation}
                              disabled={false}
-                             fdprocessedid="w5j63"
                            >
                          ...
            ...
    ...

[00:19:19.229] Browser LOG     %c[Vercel Web Analytics]%c Debug mode is enabled by default in development. No requests will be sent to the server. color: rgb(120, 120, 120) color: inherit
[00:19:19.229] Browser LOG     %c[Vercel Web Analytics]%c Running queued event color: rgb(120, 120, 120) color: inherit pageview {"path":"/","route":"/"}
[00:19:19.229] Browser LOG     %c[Vercel Web Analytics]%c [pageview] http://localhost:3000/ color: rgb(120, 120, 120) color: inherit {"dp":"/","o":"http://localhost:3000/","sdkn":"@vercel/analytics/next","sdkv":"1.3.1","sv":"0.1.3","ts":1769920396108}
[00:21:01.082] Browser LOG     ✓ Call initiated: {"callId":"019c177b-868c-7eeb-840c-f5c2bb87cefb","ok":true}
[00:21:01.082] Browser LOG     ⏳ [Poll 1] Checking call 019c177b-868c-7eeb-840c-f5c2bb87cefb status...
[00:21:01.537] Browser LOG     📊 Status response: {"completed":false,"ok":true,"status":"queued"}
[00:21:04.527] Browser LOG     ⏳ [Poll 2] Checking call 019c177b-868c-7eeb-840c-f5c2bb87cefb status...
[00:21:05.041] Browser LOG     📊 Status response: {"completed":false,"ok":true,"status":"queued"}
[00:21:08.142] Browser LOG     ⏳ [Poll 3] Checking call 019c177b-868c-7eeb-840c-f5c2bb87cefb status...
[00:21:09.053] Browser LOG     📊 Status response: {"completed":false,"ok":true,"status":"in-progress"}
[00:21:12.069] Browser LOG     ⏳ [Poll 4] Checking call 019c177b-868c-7eeb-840c-f5c2bb87cefb status...
[00:21:12.627] Browser LOG     📊 Status response: {"completed":false,"ok":true,"status":"in-progress"}
[00:21:15.646] Browser LOG     ⏳ [Poll 5] Checking call 019c177b-868c-7eeb-840c-f5c2bb87cefb status...
[00:21:16.836] Browser LOG     📊 Status response: {"completed":false,"ok":true,"status":"in-progress"}
[00:21:20.001] Browser LOG     ⏳ [Poll 6] Checking call 019c177b-868c-7eeb-840c-f5c2bb87cefb status...
[00:21:20.396] Browser LOG     📊 Status response: {"completed":false,"ok":true,"status":"in-progress"}
[00:21:23.328] Browser LOG     ⏳ [Poll 7] Checking call 019c177b-868c-7eeb-840c-f5c2bb87cefb status...
[00:21:23.592] Browser LOG     📊 Status response: {"completed":false,"ok":true,"status":"in-progress"}
[00:21:26.602] Browser LOG     ⏳ [Poll 8] Checking call 019c177b-868c-7eeb-840c-f5c2bb87cefb status...
[00:21:26.870] Browser LOG     📊 Status response: {"completed":false,"ok":true,"status":"in-progress"}
[00:21:29.877] Browser LOG     ⏳ [Poll 9] Checking call 019c177b-868c-7eeb-840c-f5c2bb87cefb status...
[00:21:30.156] Browser LOG     📊 Status response: {"completed":false,"ok":true,"status":"in-progress"}
[00:21:33.304] Browser LOG     ⏳ [Poll 10] Checking call 019c177b-868c-7eeb-840c-f5c2bb87cefb status...
[00:21:33.628] Browser LOG     📊 Status response: {"completed":false,"ok":true,"status":"in-progress"}
[00:21:36.628] Browser LOG     ⏳ [Poll 11] Checking call 019c177b-868c-7eeb-840c-f5c2bb87cefb status...
[00:21:36.917] Browser LOG     📊 Status response: {"completed":false,"ok":true,"status":"in-progress"}
[00:21:40.066] Browser LOG     ⏳ [Poll 12] Checking call 019c177b-868c-7eeb-840c-f5c2bb87cefb status...
[00:21:41.073] Browser LOG     📊 Status response: {"completed":false,"ok":true,"status":"in-progress"}
[00:21:44.088] Browser LOG     ⏳ [Poll 13] Checking call 019c177b-868c-7eeb-840c-f5c2bb87cefb status...
[00:21:44.280] Browser LOG     📊 Status response: {"completed":false,"ok":true,"status":"in-progress"}
[00:21:47.277] Browser LOG     ⏳ [Poll 14] Checking call 019c177b-868c-7eeb-840c-f5c2bb87cefb status...
[00:21:47.560] Browser LOG     📊 Status response: {"completed":false,"ok":true,"status":"in-progress"}
[00:21:50.560] Browser LOG     ⏳ [Poll 15] Checking call 019c177b-868c-7eeb-840c-f5c2bb87cefb status...
[00:21:54.415] Browser LOG     📊 Status response: {"completed":true,"ok":true,"status":"ended","summary":"Contact expressed interest in helping with the nonprofit for homeless assistance and provided email contact information for follow-up regarding a February 2026 meeting.","transcript":"AI: Hi. This is Mission Match. Calling on behalf of a volunteer project. We're reaching out because someone needs help with I have a nonprofit dedicated to the homeless. I would call Carney and Thomas Food Bank be able to assist If so, who should we contact and what are the next steps?\nUser: Yeah. I can help. I'm in a bit of a rush right now as I go. But you can contact me at noel thomas at g mail dot com.\nAI: That's\nUser: I have to hang up right now, but thank you so much for calling me again. In order to to to meet up on February seventeenth 20 26. Have to go right now and hang up, but but thank you.\nAI: Thank you for your time. We'll reach out via email Have a great day.\nUser: Thank you. Bye.\n"}
[00:21:54.415] Browser LOG     ✓ Call completed!
[00:21:54.415] Browser LOG     📋 Fetching summary for key: +16693313021
[00:21:54.534] Browser LOG     ✓ Summary fetched: {"data":{"availability":"February seventeenth 2026","call_id":"+16693313021","contact_name":"Noel Thomas","created_at":"2026-01-31T23:02:11.390326+00:00","interested":true,"next_steps":["Contact via email at noel thomas at gmail dot com","Follow up regarding meeting on February 17, 2026"],"org_id":null,"summary":"Contact expressed interest in helping with the nonprofit for homeless assistance and provided email contact information for follow-up regarding a February 2026 meeting.","updated_at":"2026-02-01T04:35:51.721+00:00","vapi_analysis":{"successEvaluation":"true","summary":"Mission Match called Noel Thomas from Carney and Thomas Food Bank to inquire about assistance for a nonprofit dedicated to the homeless. Noel confirmed their ability to help and provided an email address for follow-up, also mentioning a meeting on February 17, 2026. The call concluded with Mission Match agreeing to reach out via email, as Noel was in a rush."}},"ok":true}
[00:21:54.534] Browser LOG     ✓ UI updated to completed
[00:24:16.178] Browser INFO    %cDownload the React DevTools for a better development experience: https://react.dev/link/react-devtools font-weight:bold
[00:24:16.178] Browser ERROR   A tree hydrated but some attributes of the server rendered HTML didn't match the client properties. This won't be patched up. This can happen if a SSR-ed Client Component used:

- A server/client branch `if (typeof window !== 'undefined')`.
- Variable input such as `Date.now()` or `Math.random()` which changes each time it's called.
- Date formatting in a user's locale which doesn't match the server.
- External changing data without sending a snapshot of it along with the HTML.
- Invalid HTML tag nesting.

It can also happen if the client has a browser extension installed which messes with the HTML before React loaded.

%s%s https://react.dev/link/hydration-mismatch 

  ...
    <SegmentViewNode type="page" pagePath="/Downloads...">
      <SegmentTrieNode>
      <ClientPageRoot Component={function Home} serverProvidedParams={{...}}>
        <Home params={Promise} searchParams={Promise}>
          <main className="min-h-scre...">
            <AnimatePresence mode="wait">
              <PresenceChild isPresent={true} initial={undefined} custom={undefined} presenceAffectsLayout={true} ...>
                <LocationStep onComplete={function handleLocationComplete}>
                  <motion.div initial={{y:20}} animate={{y:0}} exit={{y:-20}} className="relative f...">
                    <div className="relative f..." style={{...}} ref={function useMotionRef.useCallback}>
                      <div>
                      <div>
                      <div>
                      <div className="relative z...">
                        <motion.div>
                        <div>
                        <form onSubmit={function handleSubmit} className="space-y-5 ...">
                          <div className="relative r...">
                            <GlowingEffect>
                            <div className="relative">
                              <Input type="text" placeholder="Enter the ..." value="" onChange={function onChange} ...>
                                <input
                                  type="text"
                                  data-slot="input"
                                  className="file:text-foreground selection:bg-primary selection:text-primary-foregrou..."
                                  placeholder="Enter the city, zipcode, state, etc. of your volunteer work"
                                  value=""
                                  onChange={function onChange}
-                                 fdprocessedid="bcmz2be"
                                >
                          <Button type="button" variant="outline" className="w-full h-1..." ...>
                            <button
                              data-slot="button"
                              className={"inline-flex items-center justify-center gap-2 whitespace-nowrap rounded-md ..."}
                              type="button"
                              onClick={function handleDetectLocation}
                              disabled={false}
-                             fdprocessedid="r5js28"
                            >
                          ...
            ...
    ...

[00:24:16.178] Browser LOG     %c[Vercel Web Analytics]%c Debug mode is enabled by default in development. No requests will be sent to the server. color: rgb(120, 120, 120) color: inherit
[00:24:16.178] Browser LOG     %c[Vercel Web Analytics]%c Running queued event color: rgb(120, 120, 120) color: inherit pageview {"path":"/","route":"/"}
[00:24:16.178] Browser LOG     %c[Vercel Web Analytics]%c [pageview] http://localhost:3000/ color: rgb(120, 120, 120) color: inherit {"dp":"/","o":"http://localhost:3000/","sdkn":"@vercel/analytics/next","sdkv":"1.3.1","sv":"0.1.3","ts":1769920693091}
[00:26:11.160] Browser LOG     ✓ Call initiated: {"callId":"019c1780-3ffa-7440-8eaa-eeeb681512f7","ok":true}
[00:26:11.160] Browser LOG     ⏳ [Poll 1] Checking call 019c1780-3ffa-7440-8eaa-eeeb681512f7 status...
[00:26:11.590] Browser LOG     📊 Status response: {"completed":false,"ok":true,"status":"queued"}
[00:26:14.585] Browser LOG     ⏳ [Poll 2] Checking call 019c1780-3ffa-7440-8eaa-eeeb681512f7 status...
[00:26:15.110] Browser LOG     📊 Status response: {"completed":false,"ok":true,"status":"in-progress"}
[00:26:18.033] Browser LOG     ⏳ [Poll 3] Checking call 019c1780-3ffa-7440-8eaa-eeeb681512f7 status...
[00:26:18.305] Browser LOG     📊 Status response: {"completed":false,"ok":true,"status":"in-progress"}
[00:26:21.330] Browser LOG     ⏳ [Poll 4] Checking call 019c1780-3ffa-7440-8eaa-eeeb681512f7 status...
[00:26:21.869] Browser LOG     📊 Status response: {"completed":false,"ok":true,"status":"in-progress"}
[00:26:24.790] Browser LOG     ⏳ [Poll 5] Checking call 019c1780-3ffa-7440-8eaa-eeeb681512f7 status...
[00:26:25.084] Browser LOG     📊 Status response: {"completed":false,"ok":true,"status":"in-progress"}
[00:26:28.234] Browser LOG     ⏳ [Poll 6] Checking call 019c1780-3ffa-7440-8eaa-eeeb681512f7 status...
[00:26:28.362] Browser LOG     📊 Status response: {"completed":false,"ok":true,"status":"in-progress"}
[00:26:31.699] Browser LOG     ⏳ [Poll 7] Checking call 019c1780-3ffa-7440-8eaa-eeeb681512f7 status...
[00:26:32.097] Browser LOG     📊 Status response: {"completed":false,"ok":true,"status":"in-progress"}
[00:26:35.273] Browser LOG     ⏳ [Poll 8] Checking call 019c1780-3ffa-7440-8eaa-eeeb681512f7 status...
[00:26:35.517] Browser LOG     📊 Status response: {"completed":false,"ok":true,"status":"in-progress"}
[00:26:38.554] Browser LOG     ⏳ [Poll 9] Checking call 019c1780-3ffa-7440-8eaa-eeeb681512f7 status...
[00:26:38.783] Browser LOG     📊 Status response: {"completed":false,"ok":true,"status":"in-progress"}
[00:26:41.797] Browser LOG     ⏳ [Poll 10] Checking call 019c1780-3ffa-7440-8eaa-eeeb681512f7 status...
[00:26:42.095] Browser LOG     📊 Status response: {"completed":false,"ok":true,"status":"in-progress"}
[00:26:45.157] Browser LOG     ⏳ [Poll 11] Checking call 019c1780-3ffa-7440-8eaa-eeeb681512f7 status...
[00:26:45.626] Browser LOG     📊 Status response: {"completed":false,"ok":true,"status":"in-progress"}
[00:26:48.715] Browser LOG     ⏳ [Poll 12] Checking call 019c1780-3ffa-7440-8eaa-eeeb681512f7 status...
[00:26:48.821] Browser LOG     📊 Status response: {"completed":false,"ok":true,"status":"in-progress"}
[00:26:51.991] Browser LOG     ⏳ [Poll 13] Checking call 019c1780-3ffa-7440-8eaa-eeeb681512f7 status...
[00:26:52.100] Browser LOG     📊 Status response: {"completed":false,"ok":true,"status":"in-progress"}
[00:26:55.104] Browser LOG     ⏳ [Poll 14] Checking call 019c1780-3ffa-7440-8eaa-eeeb681512f7 status...
[00:26:55.397] Browser LOG     📊 Status response: {"completed":false,"ok":true,"status":"in-progress"}
[00:26:58.391] Browser LOG     ⏳ [Poll 15] Checking call 019c1780-3ffa-7440-8eaa-eeeb681512f7 status...
[00:26:58.649] Browser LOG     📊 Status response: {"completed":false,"ok":true,"status":"in-progress"}
[00:27:01.641] Browser LOG     ⏳ [Poll 16] Checking call 019c1780-3ffa-7440-8eaa-eeeb681512f7 status...
[00:27:01.822] Browser LOG     📊 Status response: {"completed":false,"ok":true,"status":"in-progress"}
[00:27:05.053] Browser LOG     ⏳ [Poll 17] Checking call 019c1780-3ffa-7440-8eaa-eeeb681512f7 status...
[00:27:05.225] Browser LOG     📊 Status response: {"completed":false,"ok":true,"status":"in-progress"}
[00:27:08.436] Browser LOG     ⏳ [Poll 18] Checking call 019c1780-3ffa-7440-8eaa-eeeb681512f7 status...
[00:27:08.574] Browser LOG     📊 Status response: {"completed":true,"ok":true,"status":"ended","summary":"Mission Match called Noel regarding a volunteer project for a homeless nonprofit, Wood Kocarni and Thomas Food Bank, seeking assistance. Noel, though needing to end the call, provided their email (noelthomas@gmail.com) and suggested meeting on February 17, 2026, expressing willingness to help. Mission Match confirmed they would follow up via email to arrange the meeting.","transcript":"AI: Hi. This is Mission Match calling on behalf of a volunteer project We're reaching out because someone needs help with I have an organization dedicated to the homeless. A nonprofit. Wood Kocarni and Thomas Food Bank, be able to assist? If so, who should we contact? And what are the next steps?\nUser: Yes. So I have to go right now and hang up. However, my email is noel thomas at g mail dot com, and I'd love to meet up on February seventeenth 20 26. And I'd like to help, but I have to go right now. So so goodbye.\nAI: Thank you so much, Noel. I've noted your email. And the date. February seventeenth 2026. We'll follow-up with you by email\nUser: Yeah.\nAI: Really appreciate your willingness to help. Have a great day.\nUser: Bye.\n"}
[00:27:08.574] Browser LOG     ✓ Call completed!
[00:27:08.574] Browser LOG     📋 Fetching summary for key: +16693313021
[00:27:08.696] Browser LOG     ✓ Summary fetched: {"data":{"availability":null,"call_id":"+16693313021","contact_name":null,"created_at":"2026-01-31T23:02:11.390326+00:00","interested":null,"next_steps":[],"org_id":null,"summary":"Mission Match called Noel regarding a volunteer project for a homeless nonprofit, Wood Kocarni and Thomas Food Bank, seeking assistance. Noel, though needing to end the call, provided their email (noelthomas@gmail.com) and suggested meeting on February 17, 2026, expressing willingness to help. Mission Match confirmed they would follow up via email to arrange the meeting.","updated_at":"2026-02-01T04:41:03.405+00:00","vapi_analysis":{"successEvaluation":"false","summary":"Mission Match called Noel regarding a volunteer project for a homeless nonprofit, Wood Kocarni and Thomas Food Bank, seeking assistance. Noel, though needing to end the call, provided their email (noelthomas@gmail.com) and suggested meeting on February 17, 2026, expressing willingness to help. Mission Match confirmed they would follow up via email to arrange the meeting."}},"ok":true}
[00:27:08.696] Browser LOG     ✓ UI updated to completed
[00:28:17.005] Browser INFO    %cDownload the React DevTools for a better development experience: https://react.dev/link/react-devtools font-weight:bold
[00:28:17.005] Browser ERROR   A tree hydrated but some attributes of the server rendered HTML didn't match the client properties. This won't be patched up. This can happen if a SSR-ed Client Component used:

- A server/client branch `if (typeof window !== 'undefined')`.
- Variable input such as `Date.now()` or `Math.random()` which changes each time it's called.
- Date formatting in a user's locale which doesn't match the server.
- External changing data without sending a snapshot of it along with the HTML.
- Invalid HTML tag nesting.

It can also happen if the client has a browser extension installed which messes with the HTML before React loaded.

%s%s https://react.dev/link/hydration-mismatch 

  ...
    <SegmentViewNode type="page" pagePath="/Downloads...">
      <SegmentTrieNode>
      <ClientPageRoot Component={function Home} serverProvidedParams={{...}}>
        <Home params={Promise} searchParams={Promise}>
          <main className="min-h-scre...">
            <AnimatePresence mode="wait">
              <PresenceChild isPresent={true} initial={undefined} custom={undefined} presenceAffectsLayout={true} ...>
                <LocationStep onComplete={function handleLocationComplete}>
                  <motion.div initial={{y:20}} animate={{y:0}} exit={{y:-20}} className="relative f...">
                    <div className="relative f..." style={{...}} ref={function useMotionRef.useCallback}>
                      <div>
                      <div>
                      <div>
                      <div className="relative z...">
                        <motion.div>
                        <div>
                        <form onSubmit={function handleSubmit} className="space-y-5 ...">
                          <div className="relative r...">
                            <GlowingEffect>
                            <div className="relative">
                              <Input type="text" placeholder="Enter the ..." value="" onChange={function onChange} ...>
                                <input
                                  type="text"
                                  data-slot="input"
                                  className="file:text-foreground selection:bg-primary selection:text-primary-foregrou..."
                                  placeholder="Enter the city, zipcode, state, etc. of your volunteer work"
                                  value=""
                                  onChange={function onChange}
-                                 fdprocessedid="nsdn1"
                                >
                          <Button type="button" variant="outline" className="w-full h-1..." ...>
                            <button
                              data-slot="button"
                              className={"inline-flex items-center justify-center gap-2 whitespace-nowrap rounded-md ..."}
                              type="button"
                              onClick={function handleDetectLocation}
                              disabled={false}
-                             fdprocessedid="rcnq0e"
                            >
                          ...
            ...
    ...

[00:28:17.005] Browser LOG     %c[Vercel Web Analytics]%c Debug mode is enabled by default in development. No requests will be sent to the server. color: rgb(120, 120, 120) color: inherit
[00:28:17.005] Browser LOG     %c[Vercel Web Analytics]%c Running queued event color: rgb(120, 120, 120) color: inherit pageview {"path":"/","route":"/"}
[00:28:17.005] Browser LOG     %c[Vercel Web Analytics]%c [pageview] http://localhost:3000/ color: rgb(120, 120, 120) color: inherit {"dp":"/","o":"http://localhost:3000/","sdkn":"@vercel/analytics/next","sdkv":"1.3.1","sv":"0.1.3","ts":1769920933963}
[00:29:52.206] Browser LOG     ✓ Call initiated: {"callId":"019c1783-a09a-744b-a6b9-a1097fb368fe","ok":true}
[00:29:52.206] Browser LOG     ⏳ [Poll 1] Checking call 019c1783-a09a-744b-a6b9-a1097fb368fe status...
[00:29:52.554] Browser LOG     📊 Status response: {"completed":false,"ok":true,"status":"queued"}
[00:29:55.564] Browser LOG     ⏳ [Poll 2] Checking call 019c1783-a09a-744b-a6b9-a1097fb368fe status...
[00:29:55.741] Browser LOG     📊 Status response: {"completed":false,"ok":true,"status":"queued"}
[00:29:58.739] Browser LOG     ⏳ [Poll 3] Checking call 019c1783-a09a-744b-a6b9-a1097fb368fe status...
[00:29:59.179] Browser LOG     📊 Status response: {"completed":false,"ok":true,"status":"in-progress"}
[00:30:02.130] Browser LOG     ⏳ [Poll 4] Checking call 019c1783-a09a-744b-a6b9-a1097fb368fe status...
[00:30:02.392] Browser LOG     📊 Status response: {"completed":false,"ok":true,"status":"in-progress"}
[00:30:05.544] Browser LOG     ⏳ [Poll 5] Checking call 019c1783-a09a-744b-a6b9-a1097fb368fe status...
[00:30:06.337] Browser LOG     📊 Status response: {"completed":false,"ok":true,"status":"in-progress"}
[00:30:09.420] Browser LOG     ⏳ [Poll 6] Checking call 019c1783-a09a-744b-a6b9-a1097fb368fe status...
[00:30:09.596] Browser LOG     📊 Status response: {"completed":false,"ok":true,"status":"in-progress"}
[00:30:12.592] Browser LOG     ⏳ [Poll 7] Checking call 019c1783-a09a-744b-a6b9-a1097fb368fe status...
[00:30:12.924] Browser LOG     📊 Status response: {"completed":false,"ok":true,"status":"in-progress"}
[00:30:16.139] Browser LOG     ⏳ [Poll 8] Checking call 019c1783-a09a-744b-a6b9-a1097fb368fe status...
[00:30:16.573] Browser LOG     📊 Status response: {"completed":false,"ok":true,"status":"in-progress"}
[00:30:19.586] Browser LOG     ⏳ [Poll 9] Checking call 019c1783-a09a-744b-a6b9-a1097fb368fe status...
[00:30:19.976] Browser LOG     📊 Status response: {"completed":false,"ok":true,"status":"in-progress"}
[00:30:23.013] Browser LOG     ⏳ [Poll 10] Checking call 019c1783-a09a-744b-a6b9-a1097fb368fe status...
[00:30:23.555] Browser LOG     📊 Status response: {"completed":false,"ok":true,"status":"in-progress"}
[00:30:26.561] Browser LOG     ⏳ [Poll 11] Checking call 019c1783-a09a-744b-a6b9-a1097fb368fe status...
[00:30:27.016] Browser LOG     📊 Status response: {"completed":false,"ok":true,"status":"in-progress"}
[00:30:29.878] Browser LOG     ⏳ [Poll 12] Checking call 019c1783-a09a-744b-a6b9-a1097fb368fe status...
[00:30:30.163] Browser LOG     📊 Status response: {"completed":false,"ok":true,"status":"in-progress"}
[00:30:33.382] Browser LOG     ⏳ [Poll 13] Checking call 019c1783-a09a-744b-a6b9-a1097fb368fe status...
[00:30:33.912] Browser LOG     📊 Status response: {"completed":false,"ok":true,"status":"in-progress"}
[00:30:37.068] Browser LOG     ⏳ [Poll 14] Checking call 019c1783-a09a-744b-a6b9-a1097fb368fe status...
[00:30:37.373] Browser LOG     📊 Status response: {"completed":false,"ok":true,"status":"in-progress"}
[00:30:40.554] Browser LOG     ⏳ [Poll 15] Checking call 019c1783-a09a-744b-a6b9-a1097fb368fe status...
[00:30:40.806] Browser LOG     📊 Status response: {"completed":false,"ok":true,"status":"in-progress"}
[00:30:43.843] Browser LOG     ⏳ [Poll 16] Checking call 019c1783-a09a-744b-a6b9-a1097fb368fe status...
[00:30:44.424] Browser LOG     📊 Status response: {"completed":false,"ok":true,"status":"in-progress"}
[00:30:47.614] Browser LOG     ⏳ [Poll 17] Checking call 019c1783-a09a-744b-a6b9-a1097fb368fe status...
[00:30:47.831] Browser LOG     📊 Status response: {"completed":true,"ok":true,"status":"ended","summary":"Mission Match called Kolkarni and Thomas Food Bank to inquire about potential assistance for a homeless nonprofit, asking who to contact and next steps. Noel Thomas, from the food bank, provided his email and suggested a meeting on February 17, 2026, but was in a rush. Mission Match will follow up via email to coordinate further.","transcript":"AI: Hi. This is Mission Match calling on behalf of a volunteer project. We're reaching out to because someone needs help with I have a nonprofit dedicated to the homeless. Would Kolkarni and Thomas Food Bank be able to assist? If so, who should we contact? And what are the next steps?\nUser: Yeah. I'm in a hurry right now, but my name is Noel Thomas. And my email is noel thomas at g mail dot com. You can feel free to reach out to me I'd love to meet up with them at February seventeenth 20 26. I have to hang up right now. I'm in a busy rush right now, but thank you for calling me again.\nAI: Thank you for your time, Noel. We'll reach out via email to coordinate further. Have a great day.\nUser: Bye.\n"}
[00:30:47.831] Browser LOG     ✓ Call completed!
[00:30:47.831] Browser LOG     📋 Fetching summary for key: +16693313021
[00:30:47.969] Browser LOG     ✓ Summary fetched: {"data":{"availability":null,"call_id":"+16693313021","contact_name":null,"created_at":"2026-01-31T23:02:11.390326+00:00","interested":null,"next_steps":[],"org_id":null,"summary":"Mission Match called Kolkarni and Thomas Food Bank to inquire about potential assistance for a homeless nonprofit, asking who to contact and next steps. Noel Thomas, from the food bank, provided his email and suggested a meeting on February 17, 2026, but was in a rush. Mission Match will follow up via email to coordinate further.","updated_at":"2026-02-01T04:44:43.137+00:00","vapi_analysis":{"successEvaluation":"true","summary":"Mission Match called Kolkarni and Thomas Food Bank to inquire about potential assistance for a homeless nonprofit, asking who to contact and next steps. Noel Thomas, from the food bank, provided his email and suggested a meeting on February 17, 2026, but was in a rush. Mission Match will follow up via email to coordinate further."}},"ok":true}
[00:30:47.969] Browser LOG     ✓ UI updated to completed
